{"schemaVersion":"psywerx-research-items-v1","briefDate":"2026-09-19","briefType":"daily","items":[{"sourceItemNumber":1,"primaryCategory":"behavioral-science","categories":["behavioral-science","application-analysis"],"questionAndWhy":"Why do reward-predicting cues capture attention even when they are irrelevant to the task, and does that bias require people to selectively attend to the feature carrying the reward information? The distinction matters because reward learning is often treated as automatically producing attentional bias.","whatTheyDid":"Garre-Frutos and colleagues ran a preregistered visual-search experiment in which one colored distractor predicted high reward and another predicted low reward. The reward contingencies were identical across groups, but one group had to attend to the distractor’s color while the other reported its location, allowing the researchers to separate selective attention to the reward-predictive feature from simple awareness of the reward relationship.","whatTheyFound":"The usual value-modulated attentional-capture effect—slower responses when the high-value distractor appeared—emerged only when participants had been required to attend to the reward-predictive color. Differences in explicit contingency awareness did not explain the pattern. The study supports a role for selective attention in acquiring the bias, but it uses a tightly controlled laboratory search task rather than consequential real-world choices.","whatItMeans":"Reward history alone may not be enough to make a cue attention-grabbing; what people attend to while learning can determine which features acquire motivational pull. For influence and interface design, exposure to a rewarded cue and attention to the cue’s defining feature should be treated as different parts of the learning process.","streamTitle":"Reward-linked cues captured attention only when people had attended to the reward-predicting feature","streamSummary":"A preregistered visual-search study tested why reward-associated cues later grab attention. Participants saw the same high- and low-reward color contingencies, but only one group had to selectively attend to color while learning them. The classic reward-linked attentional-capture effect appeared only in that group and was not explained by differences in explicit awareness of the contingency. The result suggests that selective attention helps determine which features acquire reward-driven attentional priority. The task was highly controlled, so the finding should not be generalized directly to complex real-world messaging or choice.","attribution":"Garre-Frutos et al. — Psychonomic Bulletin & Review","sourceUrl":"https://doi.org/10.3758/s13423-026-02964-x","sourcePublishedAt":"2026-09-18","sourceKey":"10.3758/s13423-026-02964-x","sourceVerified":true,"briefDate":"2026-09-19","briefType":"daily","streamDecision":"publish"},{"sourceItemNumber":2,"primaryCategory":"behavioral-science","categories":["behavioral-science","application-analysis","technology-modeling"],"questionAndWhy":"Can shared community memberships provide a measurable form of “common ground” between people who may never have interacted? This matters online because people routinely interpret short, context-heavy messages using assumptions about what members of a community already know.","whatTheyDid":"Kumar and colleagues used Bluesky Starter Packs—user-curated lists organized around professions, places, identities, or interests—as community-affiliation labels. They analyzed 191,648 user pairs and compared shared community memberships with overlap in the users’ lexical repertoires, while separately accounting for proximity in the platform’s follow network.","whatTheyFound":"Lexical similarity increased monotonically as users shared more Starter Packs; users sharing one pack were roughly twice as similar as equally connected strangers. The number of topically distinct shared communities was more informative than the raw number of overlapping packs, and community co-membership added information beyond follow-network proximity. The study is observational, and lexical overlap is a proxy for common ground rather than a direct measure of shared knowledge.","whatItMeans":"Community affiliation can carry contextual information that ordinary pairwise network ties miss. For audience analysis, higher-order membership structures may help explain why the same phrase is interpreted differently across communities, but affiliation should not be treated as proof that two people hold the same beliefs or will respond similarly.","streamTitle":"Shared online communities predicted a graded common language beyond simple follow-network proximity","streamSummary":"A new Bluesky study used user-curated Starter Packs as community-affiliation labels and analyzed 191,648 user pairs. People who shared more communities also used more similar vocabularies, with one shared pack corresponding to roughly twice the lexical similarity of equally connected strangers. Topically distinct shared communities mattered more than raw overlap, and the pattern added information beyond ordinary follow-network distance. The study provides a scalable proxy for communal common ground, but it is observational and lexical overlap is not the same thing as directly demonstrating shared beliefs, knowledge, or persuasion susceptibility.","attribution":"Kumar et al. — arXiv","sourceUrl":"https://arxiv.org/abs/2609.19549","sourcePublishedAt":"2026-09-17","sourceKey":"10.48550/arxiv.2609.19549","sourceVerified":true,"briefDate":"2026-09-19","briefType":"daily","streamDecision":"publish"},{"sourceItemNumber":3,"primaryCategory":"behavioral-science","categories":["behavioral-science","technology-modeling","application-analysis"],"questionAndWhy":"When a human working with an imperfect system receives bad feedback, does it matter whether the failure appears to be the person’s fault or the system’s fault? The answer matters for human-machine teaming because perceived control and blame may change how people prepare for the next decision.","whatTheyDid":"Grote and colleagues used an EEG color-discrimination task with 35 participants. Blocks provided either accurate feedback, feedback suggesting the participant was making more errors, or feedback indicating that the response buttons were malfunctioning. The researchers combined behavior, diffusion modeling, and EEG measures of preparation and feedback evaluation.","whatTheyFound":"Both kinds of manipulated failure feedback slowed responses and reduced evidence-accumulation efficiency relative to accurate feedback. Self-attributed versus system-attributed errors differed in nondecision-time components, and system-attributed errors produced stronger midfrontal theta responses during feedback evaluation. Preparatory alpha and beta activity was also reduced when outcome controllability was disrupted. The sample was small and the task artificial.","whatItMeans":"Perceived controllability and error attribution may affect different parts of cognition: whether people invest resources before acting and how they process failure afterward. For human-AI systems, error messages that distinguish operator mistakes from system failures may change subsequent performance rather than merely changing satisfaction or trust.","streamTitle":"People prepared and processed feedback differently depending on whether failure seemed to be theirs or the system’s","streamSummary":"An EEG experiment with 35 participants manipulated whether task failures appeared to come from the person or from malfunctioning equipment. Both forms of unreliable feedback slowed responses and reduced evidence-accumulation efficiency, but self-attributed and system-attributed errors produced different timing and neural feedback patterns. The results suggest that perceived controllability and blame can affect different stages of cognitive processing. The study is small and laboratory-based, but it offers a useful human-machine lesson: how a system attributes an error may influence what the operator does next, not just how the operator feels about the system.","attribution":"Grote et al. — Cognitive, Affective, & Behavioral Neuroscience","sourceUrl":"https://doi.org/10.3758/s13415-026-01494-2","sourcePublishedAt":"2026-09-18","sourceKey":"10.3758/s13415-026-01494-2","sourceVerified":true,"briefDate":"2026-09-19","briefType":"daily","streamDecision":"publish"},{"sourceItemNumber":4,"primaryCategory":"behavioral-science","categories":["behavioral-science","application-analysis"],"questionAndWhy":"Can unrelated activity immediately after learning make people forget meaningful factual information, or is this kind of retroactive interference too weak or inconsistent outside simple laboratory material? The question matters for training and communication environments where new tasks begin immediately after important information is presented.","whatTheyDid":"Fisher and Mercer ran three experiments. Participants learned trivia facts and then either rested or completed an unrelated distraction task during the retention interval. Experiment 1 used a within-person order manipulation with 121 participants, Experiment 2 included 100 participants, and Experiment 3 compared separate rest and distraction groups with 135 participants.","whatTheyFound":"Experiment 1 showed no overall interference effect, although distraction was more damaging when it occurred during the second test. Experiments 2 and 3 found substantially poorer recall after distraction, and the second-test disadvantage appeared again. The mixed first experiment is important: the effect was not uniformly robust across designs, but the later experiments supported meaningful non-specific retroactive interference.","whatItMeans":"What happens immediately after learning can matter even when the next activity is unrelated to what was learned. For briefings, instruction, or message testing, retention should not be assumed from immediate comprehension